{
  "name": "AES LUAT benchmark - TEMPLATE KHÔNG DÙNG ĐỂ BÁO CÁO",
  "version": "0.1.0-template",
  "description": "Sao chép thành questions.json, thay toàn bộ giá trị REPLACE_*, biên soạn đủ 80-100 câu và bật enabled sau khi chuyên gia duyệt.",
  "created_by": "REPLACE_WITH_AUTHOR",
  "reviewed_by": "REPLACE_WITH_LEGAL_REVIEWER",
  "cases": [
    {
      "id": "SINGLE_TEMPLATE_001",
      "enabled": false,
      "category": "single_hop",
      "question": "REPLACE_WITH_A_SINGLE_HOP_LEGAL_QUESTION",
      "expected_statuses": ["full_answer"],
      "gold_answer": "REPLACE_WITH_EXPERT_REFERENCE_ANSWER",
      "gold_citation_groups": [
        ["REPLACE_WITH_PHYSICAL_PROVISION_ID"]
      ],
      "answer_rubric": {
        "required_facts": [
          {
            "fact_id": "fact_1",
            "description": "REPLACE_WITH_ATOMIC_REQUIRED_FACT",
            "any_of": ["REPLACE_WITH_ACCEPTED_PHRASE"],
            "patterns": []
          }
        ],
        "forbidden_facts": [],
        "minimum_fact_coverage": 1.0
      },
      "notes": "Mỗi nhóm citation là một yêu cầu chứng cứ; các ID trong cùng nhóm là phương án tương đương."
    },
    {
      "id": "MULTI_TEMPLATE_001",
      "enabled": false,
      "category": "multi_hop",
      "question": "REPLACE_WITH_A_MULTI_HOP_LEGAL_QUESTION",
      "expected_statuses": ["full_answer", "partial_answer"],
      "gold_answer": "REPLACE_WITH_EXPERT_REFERENCE_ANSWER",
      "gold_citation_groups": [
        ["REPLACE_WITH_PROVISION_ID_FOR_HOP_1"],
        ["REPLACE_WITH_PROVISION_ID_FOR_HOP_2"]
      ],
      "answer_rubric": {
        "required_facts": [
          {
            "fact_id": "hop_1_fact",
            "description": "REPLACE_WITH_FIRST_REQUIRED_FACT",
            "any_of": ["REPLACE_WITH_ACCEPTED_PHRASE_FOR_HOP_1"],
            "patterns": []
          },
          {
            "fact_id": "hop_2_fact",
            "description": "REPLACE_WITH_SECOND_REQUIRED_FACT",
            "any_of": ["REPLACE_WITH_ACCEPTED_PHRASE_FOR_HOP_2"],
            "patterns": []
          }
        ],
        "forbidden_facts": [],
        "minimum_fact_coverage": 1.0
      },
      "notes": "Nếu chấp nhận partial_answer, rubric vẫn phải mô tả rõ phần tối thiểu được xem là đúng."
    },
    {
      "id": "OOS_TEMPLATE_001",
      "enabled": false,
      "category": "out_of_scope",
      "question": "REPLACE_WITH_A_QUESTION_OUTSIDE_THE_LOADED_LEGAL_CORPUS",
      "expected_statuses": ["refusal"],
      "gold_answer": "",
      "gold_citation_groups": [],
      "answer_rubric": {
        "required_facts": [],
        "forbidden_facts": [],
        "minimum_fact_coverage": 1.0
      },
      "notes": "Refusal phải có sources rỗng; retrieved_sources có thể tồn tại để audit và không được tính là citation."
    },
    {
      "id": "TEMPORAL_TEMPLATE_001",
      "enabled": false,
      "category": "temporal_aware",
      "question": "REPLACE_WITH_A_QUESTION_THAT_EXPLICITLY_STATES_THE_AS_OF_DATE",
      "as_of_date": "2025-01-01",
      "expected_statuses": ["full_answer"],
      "gold_answer": "REPLACE_WITH_EXPERT_REFERENCE_ANSWER_FOR_THE_DATE",
      "gold_citation_groups": [
        ["REPLACE_WITH_EFFECTIVE_PHYSICAL_PROVISION_ID"]
      ],
      "answer_rubric": {
        "required_facts": [
          {
            "fact_id": "effective_version_fact",
            "description": "REPLACE_WITH_FACT_VALID_AT_AS_OF_DATE",
            "any_of": ["REPLACE_WITH_ACCEPTED_PHRASE"],
            "patterns": []
          }
        ],
        "forbidden_facts": [
          {
            "fact_id": "superseded_version_fact",
            "description": "REPLACE_WITH_FACT_FROM_WRONG_VERSION",
            "any_of": ["REPLACE_WITH_SUPERSEDED_PHRASE"],
            "patterns": []
          }
        ],
        "minimum_fact_coverage": 1.0
      },
      "require_temporal_warning": false,
      "notes": "as_of_date là metadata kiểm thử; ngày phải được viết rõ trong question vì API hiện chỉ nhận question."
    }
  ]
}
